{
  "decisionId": "40000000-0000-4000-8000-000000000002",
  "evaluationRunId": "30000000-0000-4000-8000-000000000002",
  "decisionCaseId": "case-1001",
  "producer": "mock-evaluator",
  "originalPurpose": "LOAN_ELIGIBILITY_ASSESSMENT",
  "subjectType": "LOAN_APPLICATION",
  "proposal": "PROPOSE_MORE_EVIDENCE",
  "status": "PROPOSED",
  "confidence": 0.65,
  "usedEvidenceRefs": ["snapshot://loan-1001/v3"],
  "modelVersion": "mock-v1",
  "promptVersion": "mock-prompt-v1",
  "validUntil": "2026-01-16T09:10:00+09:00"
}
